{
  "$schema": "./schemas/loading-units-schema.json",
  "width": 1000,
  "depth": 300,
  "loading-unit-classes": [
    {
      "id": "classe_300",
      "max-load-capacity": 300,
      "tare": 120
    },
    {
      "id": "c700",
      "max-load-capacity": 700,
      "tare": 150
    }
  ],
  "loading-units": [
    {
      "class": "classe_300",
      "code": 1
    },
    {
      "class": "c700",
      "code": 2
    },
    {
      "class": "classe_300",
      "code": 3
    }
  ]
}
